{
  "firm": "Salesforce",
  "sector": "technology",
  "programs": [
    {
      "id": "futureforce-tech-launchpad",
      "name": "Futureforce Tech Launchpad",
      "audience": "sophomore",
      "source": {
        "url": "https://info.codepath.org/futureforce-tech-launchpad",
        "checked": "2026-07-29",
        "status": "ok",
        "note": "Tier 2 (CodePath partner page). Program dates listed are 'June 1 - August 7, 2026' — a cohort already in progress as of the 2026-07-29 check date. Page does not yet show a 2027-cycle application window; next-cycle opening date (expected ~October per typical pattern) is not stated."
      },
      "apply": {
        "url": "https://info.codepath.org/futureforce-tech-launchpad",
        "kind": "program_page",
        "checked": "2026-07-29"
      },
      "fields": {
        "class_year": {
          "state": "stated",
          "tier": 2,
          "quote": "Bachelor's graduation year: 2028",
          "source_url": "https://info.codepath.org/futureforce-tech-launchpad"
        },
        "sponsorship": {
          "state": "silent",
          "tier": 2,
          "source_url": "https://info.codepath.org/futureforce-tech-launchpad"
        },
        "process": {
          "state": "unverified",
          "tier": 2,
          "source_url": "https://info.codepath.org/futureforce-tech-launchpad"
        },
        "compensation": {
          "state": "unverified",
          "tier": 2,
          "source_url": null
        }
      },
      "cooling_off": {
        "state": "silent",
        "tier": 2,
        "source_url": "https://info.codepath.org/futureforce-tech-launchpad",
        "checked": "2026-07-29",
        "parsed": {
          "trigger": "unknown",
          "duration_months": null,
          "scope": "unknown",
          "resets_allowed": null
        },
        "notes": "Page read in full; no reapplication/cooling-off language found."
      },
      "cycle": "2026 cohort (most recent published data; 2027-cycle dates not yet posted on this page as of check date)",
      "location": "Salesforce Tower, San Francisco",
      "opens": "unverified",
      "closes": "February 22, 2026"
    }
  ],
  "provenance": {
    "origin": "per-firm web research, one agent per firm",
    "transcribed": "2026-07-29",
    "note": "Quotes were copied from the firm's own pages by the researching agent and passed through normalisation untouched. Rows the researcher could not locate were dropped, not guessed. Merged with rows transcribed from a private posting tracker."
  }
}
