{
  "firm": "Uber",
  "sector": "technology",
  "programs": [
    {
      "id": "uberstar",
      "name": "UberSTAR",
      "audience": "freshman",
      "source": {
        "url": "https://www.uber.com/us/en/careers/uberstar/",
        "checked": "2026-07-29",
        "status": "dead",
        "note": "HTTP 404 on two fetch attempts, both with and without tracking query parameter. Adjacent page jobs.uber.com/en/teams/emerging-talent/ loaded successfully (not JS-blocked) but contains no program-specific text beyond using 'UberSTAR' as an intern job title in employee bios."
      },
      "apply": {
        "url": "https://www.uber.com/us/en/careers/",
        "kind": "careers_hub",
        "checked": "2026-08-08",
        "note": "Uber rejects non-browser fetches (HTTP 406); the page loads normally in a browser."
      },
      "fields": {
        "class_year": {
          "state": "unverified",
          "tier": 3,
          "source_url": null
        },
        "sponsorship": {
          "state": "unverified",
          "tier": 3,
          "source_url": null
        },
        "process": {
          "state": "unverified",
          "tier": 3,
          "source_url": null
        },
        "compensation": {
          "state": "unverified",
          "tier": 3,
          "source_url": null
        }
      },
      "cooling_off": {
        "state": "unverified",
        "tier": 3,
        "source_url": null,
        "checked": "2026-07-29",
        "parsed": {
          "trigger": "unknown",
          "duration_months": null,
          "scope": "unknown",
          "resets_allowed": null
        },
        "notes": "No Uber-owned page was successfully read for this field; not claiming silence since the primary URL never loaded."
      },
      "cycle": "2027",
      "location": "US"
    },
    {
      "id": "uber-2027-swe-internship-career-prep-summer-2027",
      "name": "Uber 2027 SWE Internship / Career Prep",
      "audience": "undergraduate",
      "source": {
        "url": null,
        "checked": "2026-07-22",
        "check_method": "manual",
        "status": "url_pending",
        "note": "Verbatim quote recorded from the source posting, but the URL was not captured at the time. Not independently citable until re-sourced."
      },
      "apply": {
        "url": "https://www.uber.com/us/en/careers/",
        "kind": "careers_hub",
        "checked": "2026-08-08",
        "note": "Uber rejects non-browser fetches (HTTP 406); the page loads normally in a browser."
      },
      "fields": {
        "class_year": {
          "state": "unverified",
          "checked": "2026-07-22",
          "summary_note": "\"3rd/4th year\" UberSTAR is the channel."
        },
        "sponsorship": {
          "state": "unverified"
        },
        "process": {
          "state": "unverified"
        },
        "compensation": {
          "state": "unverified"
        }
      },
      "cooling_off": {
        "state": "unverified"
      },
      "unfiled_quotes": [
        {
          "quote": "3rd/4th year",
          "source_url": null,
          "source_status": "url_pending"
        }
      ],
      "cycle": "Summer 2027",
      "status": "unknown"
    }
  ],
  "provenance": {
    "origin": "per-firm web research, one agent per firm",
    "transcribed": "2026-07-29",
    "note": "Quotes were copied from the firm's own pages by the researching agent and passed through normalisation untouched. Rows the researcher could not locate were dropped, not guessed. Merged with rows transcribed from a private posting tracker."
  }
}
