{
  "firm": "BNY",
  "sector": "banking_finance",
  "programs": [
    {
      "id": "pre-internship",
      "name": "Pre-Internship",
      "audience": "freshman",
      "source": {
        "url": "https://www.bny.com/corporate/global/en/about-us/careers/students.html",
        "checked": "2026-08-10",
        "check_method": "static",
        "status": "ok",
        "note": "Firm's own students page listing its early-career programs."
      },
      "apply": {
        "url": "https://www.bny.com/corporate/global/en/about-us/careers/students.html",
        "kind": "program_page",
        "checked": "2026-08-10",
        "note": "Firm's own students page; the program entry links to its own registration page."
      },
      "fields": {
        "class_year": {
          "state": "stated",
          "tier": 1,
          "quote": "Pre-Internship Virtual experience designed for U.S. undergrad freshmen and sophomores, this virtual program offers an early introduction to financial services.",
          "source_url": "https://www.bny.com/corporate/global/en/about-us/careers/students.html",
          "source_status": "ok",
          "checked": "2026-08-10"
        },
        "sponsorship": {
          "state": "silent",
          "tier": 1,
          "source_url": "https://www.bny.com/corporate/global/en/about-us/careers/students.html",
          "checked": "2026-08-10"
        },
        "process": {
          "state": "silent",
          "tier": 1,
          "source_url": "https://www.bny.com/corporate/global/en/about-us/careers/students.html",
          "checked": "2026-08-10"
        },
        "compensation": {
          "state": "silent",
          "tier": 1,
          "source_url": "https://www.bny.com/corporate/global/en/about-us/careers/students.html",
          "checked": "2026-08-10"
        }
      },
      "cooling_off": {
        "state": "silent",
        "tier": 1,
        "source_url": "https://www.bny.com/corporate/global/en/about-us/careers/students.html",
        "checked": "2026-08-10",
        "parsed": {
          "trigger": "unknown",
          "duration_months": null,
          "scope": "unknown",
          "resets_allowed": null,
          "application_cap": null,
          "restrictive": null
        },
        "notes": "The page carries no sentence addressing reapplication, waiting periods, or a cap on applications. Searched the fetched markup for 'reappl', 're-appl', 'apply again' and 'waiting period': no match."
      },
      "unfiled_quotes": [
        {
          "quote": "Accepting Registrations Beginning January 11, 2027",
          "source_url": "https://www.bny.com/corporate/global/en/about-us/careers/students.html",
          "source_status": "ok"
        }
      ],
      "status": "unknown"
    },
    {
      "id": "internship",
      "name": "Internship",
      "audience": "unknown",
      "source": {
        "url": "https://www.bny.com/corporate/global/en/about-us/careers/students.html",
        "checked": "2026-08-10",
        "check_method": "static",
        "status": "ok",
        "note": "Firm's own students page listing its early-career programs."
      },
      "apply": {
        "url": "https://www.bny.com/corporate/global/en/about-us/careers/students.html",
        "kind": "program_page",
        "checked": "2026-08-10",
        "note": "Firm's own students page; the program entry links to its own application page."
      },
      "fields": {
        "class_year": {
          "state": "silent",
          "tier": 1,
          "source_url": "https://www.bny.com/corporate/global/en/about-us/careers/students.html",
          "checked": "2026-08-10"
        },
        "sponsorship": {
          "state": "silent",
          "tier": 1,
          "source_url": "https://www.bny.com/corporate/global/en/about-us/careers/students.html",
          "checked": "2026-08-10"
        },
        "process": {
          "state": "silent",
          "tier": 1,
          "source_url": "https://www.bny.com/corporate/global/en/about-us/careers/students.html",
          "checked": "2026-08-10"
        },
        "compensation": {
          "state": "silent",
          "tier": 1,
          "source_url": "https://www.bny.com/corporate/global/en/about-us/careers/students.html",
          "checked": "2026-08-10"
        }
      },
      "cooling_off": {
        "state": "silent",
        "tier": 1,
        "source_url": "https://www.bny.com/corporate/global/en/about-us/careers/students.html",
        "checked": "2026-08-10",
        "parsed": {
          "trigger": "unknown",
          "duration_months": null,
          "scope": "unknown",
          "resets_allowed": null,
          "application_cap": null,
          "restrictive": null
        },
        "notes": "The page carries no sentence addressing reapplication, waiting periods, or a cap on applications. Searched the fetched markup for 'reappl', 're-appl', 'apply again' and 'waiting period': no match."
      },
      "unfiled_quotes": [
        {
          "quote": "Internship 10 week internship offering real-world experience across core areas of financial services.",
          "source_url": "https://www.bny.com/corporate/global/en/about-us/careers/students.html",
          "source_status": "ok"
        }
      ],
      "status": "unknown"
    }
  ],
  "provenance": {
    "origin": "firm's own students page",
    "transcribed": "2026-08-10",
    "note": "The Pre-Internship program is stated to be for first- and second-year undergraduates; audience is recorded as 'freshman' because that is the earliest year the firm names, and the verbatim quote carries the full range. The Internship entry states a duration and nothing about class year, so its class_year is silent and its audience is 'unknown'."
  }
}
