{
  "firm": "Dexcom 2027 US Summer Internship early-interest pipeline",
  "sector": "other",
  "programs": [
    {
      "id": "dexcom-2027-us-summer-internship-early-interest-pipeline",
      "name": "Dexcom 2027 US Summer Internship early-interest pipeline",
      "audience": "unknown",
      "source": {
        "url": null,
        "checked": "2026-07-27",
        "check_method": "manual",
        "status": "url_pending",
        "note": "Mid-tier med-device; log only if a real posting with clean eligibility appears."
      },
      "fields": {
        "class_year": {
          "state": "unverified"
        },
        "sponsorship": {
          "state": "unverified"
        },
        "process": {
          "state": "unverified"
        },
        "compensation": {
          "state": "unverified"
        }
      },
      "cooling_off": {
        "state": "unverified"
      },
      "status": "unknown"
    }
  ],
  "provenance": {
    "origin": "private posting tracker, transcribed programmatically",
    "transcribed": "2026-07-29",
    "note": "Quotes are byte-for-byte substrings of quoted spans in the source spreadsheet. Unquoted text became summary_note on unverified fields, never a quote."
  }
}
