{
  "firm": "Bridgewater Associates",
  "sector": "asset_management",
  "programs": [
    {
      "id": "rising-fellows",
      "name": "Rising Fellows",
      "audience": "sophomore",
      "source": {
        "url": "https://www.bridgewater.com/working-at-bridgewater/students",
        "checked": "2026-07-29",
        "status": "ok",
        "note": "Page loaded successfully (static HTML, no JSON-LD) but contains no mention of 'Rising Fellows' at all. Only generic culture/mission content and a link to the Investment Associate Internship application."
      },
      "fields": {
        "class_year": {
          "state": "silent",
          "tier": 3,
          "source_url": "https://www.bridgewater.com/working-at-bridgewater/students"
        },
        "sponsorship": {
          "state": "silent",
          "tier": 3,
          "source_url": "https://www.bridgewater.com/working-at-bridgewater/students"
        },
        "process": {
          "state": "unverified",
          "tier": 3,
          "source_url": null
        },
        "compensation": {
          "state": "unverified",
          "tier": 3,
          "source_url": null
        }
      },
      "cooling_off": {
        "state": "unverified",
        "tier": 3,
        "source_url": null,
        "checked": "2026-07-29",
        "parsed": {
          "trigger": "unknown",
          "duration_months": null,
          "scope": "unknown",
          "resets_allowed": null
        },
        "notes": "No reapplication language found anywhere checked."
      },
      "cycle": "2027 (sophomore-year entry, feeder for Summer 2027-adjacent internship cycles)",
      "location": "unverified"
    },
    {
      "id": "investment-associate-intern",
      "name": "Investment Associate Intern",
      "audience": "undergraduate",
      "source": {
        "url": "https://job-boards.greenhouse.io/bridgewatercampusrecruiting/jobs/8459860002",
        "checked": "2026-07-29",
        "status": "ok",
        "note": "Listing titled '2027 Investment Associate Intern - Bridgewater Immersion | AI Innovation Hackathon' confirmed live on Bridgewater's own Greenhouse ATS. WebFetch's text extraction returned no body copy (likely JS-rendered posting detail below the fold/behind a script) so no eligibility, sponsorship, process, or comp language could be captured verbatim despite two direct fetch attempts."
      },
      "fields": {
        "class_year": {
          "state": "unverified",
          "tier": 3,
          "source_url": "https://job-boards.greenhouse.io/bridgewatercampusrecruiting/jobs/8459860002"
        },
        "sponsorship": {
          "state": "unverified",
          "tier": 3,
          "source_url": "https://job-boards.greenhouse.io/bridgewatercampusrecruiting/jobs/8459860002"
        },
        "process": {
          "state": "unverified",
          "tier": 3,
          "source_url": "https://job-boards.greenhouse.io/bridgewatercampusrecruiting/jobs/8459860002"
        },
        "compensation": {
          "state": "unverified",
          "tier": 3,
          "source_url": null
        }
      },
      "cooling_off": {
        "state": "unverified",
        "tier": 3,
        "source_url": null,
        "checked": "2026-07-29",
        "parsed": {
          "trigger": "unknown",
          "duration_months": null,
          "scope": "unknown",
          "resets_allowed": null
        }
      },
      "cycle": "2027",
      "location": "New York City"
    }
  ],
  "provenance": {
    "origin": "per-firm web research, one agent per firm",
    "transcribed": "2026-07-29",
    "note": "Quotes were copied from the firm's own pages by the researching agent and passed through normalisation untouched. Rows the researcher could not locate were dropped, not guessed. Merged with rows transcribed from a private posting tracker."
  }
}
