{
  "firm": "Federal Reserve Bank of San Francisco",
  "sector": "government",
  "programs": [
    {
      "id": "student-programs-and-internships",
      "name": "Summer Internship Program",
      "audience": "all",
      "source": {
        "url": "https://www.frbsf.org/work-with-us/student-programs-and-internships/",
        "checked": "2026-08-10",
        "check_method": "static",
        "status": "ok",
        "note": "Bank's own student-programs-and-internships page."
      },
      "apply": {
        "url": "https://www.frbsf.org/work-with-us/student-programs-and-internships/",
        "kind": "program_page",
        "checked": "2026-08-10",
        "note": "Bank's own student-programs page, which links to the application."
      },
      "fields": {
        "class_year": {
          "state": "stated",
          "tier": 1,
          "quote": "Our internship and fellowship opportunities at the SF Fed give college and graduate students a chance to experience work life in a vibrant, dynamic, and collaborative environment.",
          "source_url": "https://www.frbsf.org/work-with-us/student-programs-and-internships/",
          "source_status": "ok",
          "checked": "2026-08-10"
        },
        "sponsorship": {
          "state": "silent",
          "tier": 1,
          "source_url": "https://www.frbsf.org/work-with-us/student-programs-and-internships/",
          "checked": "2026-08-10"
        },
        "process": {
          "state": "silent",
          "tier": 1,
          "source_url": "https://www.frbsf.org/work-with-us/student-programs-and-internships/",
          "checked": "2026-08-10"
        },
        "compensation": {
          "state": "silent",
          "tier": 1,
          "source_url": "https://www.frbsf.org/work-with-us/student-programs-and-internships/",
          "checked": "2026-08-10"
        }
      },
      "cooling_off": {
        "state": "silent",
        "tier": 1,
        "source_url": "https://www.frbsf.org/work-with-us/student-programs-and-internships/",
        "checked": "2026-08-10",
        "parsed": {
          "trigger": "unknown",
          "duration_months": null,
          "scope": "unknown",
          "resets_allowed": null,
          "application_cap": null,
          "restrictive": null
        },
        "notes": "The page carries no sentence addressing reapplication, waiting periods, or a cap on applications. Searched the fetched markup for 'reappl', 're-appl' and 'apply again': no match."
      },
      "unfiled_quotes": [
        {
          "quote": "If you’re a recent college graduate or early in your career looking to gain experience at the Fed, apply to our Summer Internship Program.",
          "source_url": "https://www.frbsf.org/work-with-us/student-programs-and-internships/",
          "source_status": "ok"
        },
        {
          "quote": "We offer graduate students the opportunity to interact with research economists and visiting faculty, make progress on their dissertation research, and receive mentorship from senior economists.",
          "source_url": "https://www.frbsf.org/work-with-us/student-programs-and-internships/",
          "source_status": "ok"
        }
      ],
      "status": "unknown"
    }
  ],
  "provenance": {
    "origin": "Bank's own student-programs page",
    "transcribed": "2026-08-10",
    "note": "This is the thinnest of the Reserve Bank records in this pass. The Bank names who its programmes are for but states no year of study, no application window and no pay, so three of four fields are silent. It is recorded because the class-year sentence is the Bank's own and tier 1, not to raise a count. Sponsorship is silent: the page contains no occurrence of citizen, visa, CPT, OPT, sponsor or work authorisation. That silence is worth noting rather than assuming, because the Federal Reserve Board states a flat citizenship bar and the Atlanta Fed states a CPT position, while this body publishes neither. Silent here means only that nothing is published on the point."
  }
}
