{
  "firm": "HRT",
  "sector": "other",
  "programs": [
    {
      "id": "hrt-swe-intern-2027-summer-2027",
      "name": "HRT SWE Intern 2027",
      "audience": "undergraduate",
      "source": {
        "url": null,
        "checked": "2026-07-22",
        "check_method": "manual",
        "status": "url_pending",
        "note": "Verbatim quote recorded from the source posting, but the URL was not captured at the time. Not independently citable until re-sourced."
      },
      "fields": {
        "class_year": {
          "state": "unverified",
          "checked": "2026-07-22",
          "summary_note": "\"Eligible for full-time roles in 2028.\""
        },
        "sponsorship": {
          "state": "unverified"
        },
        "process": {
          "state": "unverified"
        },
        "compensation": {
          "state": "unverified"
        }
      },
      "cooling_off": {
        "state": "unverified"
      },
      "unfiled_quotes": [
        {
          "quote": "Eligible for full-time roles in 2028.",
          "source_url": null,
          "source_status": "url_pending"
        }
      ],
      "cycle": "Summer 2027",
      "status": "unknown"
    }
  ],
  "provenance": {
    "origin": "private posting tracker, transcribed programmatically",
    "transcribed": "2026-07-29",
    "note": "Quotes are byte-for-byte substrings of quoted spans in the source spreadsheet. Unquoted text became summary_note on unverified fields, never a quote."
  }
}
