{
  "firm": "SEO (Sponsors for Educational Opportunity)",
  "sector": "other",
  "programs": [
    {
      "id": "seo-placement-tier-summer-2027",
      "name": "SEO placement tier",
      "audience": "undergraduate",
      "source": {
        "url": null,
        "checked": "2026-07-21",
        "check_method": "manual",
        "status": "url_pending",
        "note": "Verbatim quote recorded from the source posting, but the URL was not captured at the time. Not independently citable until re-sourced."
      },
      "apply": {
        "url": "https://career.seo-usa.org/",
        "kind": "careers_hub",
        "checked": "2026-08-08"
      },
      "fields": {
        "class_year": {
          "state": "unverified",
          "checked": "2026-07-21",
          "summary_note": "Permanent work authorization required."
        },
        "sponsorship": {
          "state": "unverified"
        },
        "process": {
          "state": "unverified"
        },
        "compensation": {
          "state": "unverified"
        }
      },
      "cooling_off": {
        "state": "unverified"
      },
      "cycle": "Summer 2027",
      "status": "unknown"
    }
  ],
  "provenance": {
    "origin": "private posting tracker, transcribed programmatically",
    "transcribed": "2026-07-29",
    "note": "Quotes are byte-for-byte substrings of quoted spans in the source spreadsheet. Unquoted text became summary_note on unverified fields, never a quote."
  }
}
